{
  "id": "GENKI_NATIVE_2026",
  "provider": "Genki",
  "product_name": "Genki Native (Basic)",
  "effective_date": "2026-06-08",
  "policy_version": "2026-06",
  "specs": {
    "type": "international health insurance",
    "overall_limit": 1000000,
    "currency": "EUR",
    "deductible": null,
    "copay": null,
    "payment_cadence": null,
    "contract_commitment_months": null,
    "comprehensive": true,
    "covers_public_health_system_risks": null,
    "unlimited": null,
    "moratorium_days": null,
    "jurisdiction_facts": {
      "CO": {
        "authorized": true,
        "evidence": [
          {
            "source_id": "GENKI_NATIVE_COVERAGE_2026",
            "locator": "Global Coverage",
            "excerpt": "Global Coverage: All countries are covered, including those with travel warnings."
          }
        ]
      },
      "HR": {
        "authorized": true,
        "evidence": [
          {
            "source_id": "GENKI_NATIVE_COVERAGE_2026",
            "locator": "Global Coverage",
            "excerpt": "Global Coverage: All countries are covered, including those with travel warnings."
          }
        ]
      }
    }
  },
  "evidence": [
    {
      "source_id": "GENKI_NATIVE_COVERAGE_2026",
      "locator": "Covered Benefits (Both Plans)",
      "excerpt": "Accidents & emergencies. Outpatient and inpatient medical care. Direct payment to hospitals for inpatient care. Emergency and medically necessary transport."
    },
    {
      "source_id": "GENKI_NATIVE_COVERAGE_2026",
      "locator": "Maternity",
      "excerpt": "Maternity care (after 12-month waiting period)."
    },
    {
      "source_id": "GENKI_NATIVE_COVERAGE_2026",
      "locator": "Level of benefits",
      "excerpt": "Genki Native Basic EUR 1,000,000 maximum coverage per insurance year."
    }
  ]
}
